Title,Price
"Extra Virgin Olive Oil, Organic",$10.99
"Dill Pickle Crispy Covered Peanut, Chip Nuts",$1.99
"Salt & Vinegar Crispy Covered Peanut, Chip Nuts",$1.99
"Salted Original Crispy Covered Peanut, Chip Nuts",$1.99
"Southern Bbq Crispy Covered Peanut, Chip Nuts",$1.99
Boneless Butterfly Pork Chops,$8.16
"Unsweetened Original Flavour Oat Beverage, Zero Sugar",$4.49
"Organic Garlic Powder Bag, Organic",$2.27
"Cauliflower Florets, Organic",$3.99
"Organic Ground Cayenne Pepper Bag, Organic",$2.27
Organic Cranberries,$3.98
"Organic Ground Black Pepper, Organic",$2.27
"Frozen Whole Kernel Corn, Organic",$3.99
"Organic Paprika, Organic",$2.27
"Organic Onion Powder Bag, Organic",$2.27
"Organic Crushed Red Cayenne Pepper Bag, Organic",$2.27
"Organic Leaves Basil, Organic",$2.27
"Chickpeas, Organic",$1.99
"Red Kidney Beans, Organic",$1.99
"Black Beans, Organic",$1.99
"Banana, Cinnamon and Whole Grains Puree for 6+ Months",$2.29
Organic Oatmeal Baby Cereal,$5.99
"Penne Rigate Pasta, Organic",$3.29
"Mixed Beans, Organic",$1.99
"Organic Spaghetti, Organic",$3.29
Carrots and Ancient Grains Purée for 6+ Months,$2.29
"Apple, Blueberry Crisp Puree for 6+ Months",$2.29
"Fusilli Pasta, Organic",$3.29
Mango Yogurt and Rolled Oats Puree for 6+ Months,$2.29
Organic Coconut and Cashew Butter Granola,$5.99
Frozen Organic Enchilada with Spanish Rice and Beans,$7.49
Organic Minced Garlic,$3.48
Cinnamon Harvest Organic Cereals,$6.49
Organic Tortillas,$5.49
"Organic Original Soy Beverage, Organic",$3.88
Original Unsweetened Almond Beverage,$3.88
Vanilla Flavoured Oat Beverage,$3.88
Original Flavoured Oat Beverage,$3.88
Unsalted Deluxe Mixed Nuts,$19.99
Organic Instant Oatmeal Packets Variety Pack,$5.49
Organic Whole Grain Tri-Colour Quinoa,$9.59
Original Flavour Organic Soy Plant-Based Beverage,$4.79
Organic Thin Pizza Crust,$4.49
"Organic Gluten Free Apples, Bananas, Blueberries and...",$2.49
"Organic Gluten Free Apples, Spinach, Kiwi, Broccoli ...",$2.49
"Organic Gluten Free Bananas, Strawberries, Peaches a...",$2.49
"Organic Tomato and Carrot Flavoured Corn Snacks, Lov...",$2.29
Organic Gluten Free Apple Oatmeal Snack Bar,$4.49
Organic Gluten Free Oat Strawberry Snack Bar,$4.49
14% Organic Sour Cream,$6.49
Organic Rice and Amaranth Penne Pasta,$4.99
"Organic Cranberries, Fruit&Co",$3.98
"Organic Dried Apricots, Naturalia",$6.88
"Sliced Organic Dried Mango, Naturalia",$5.98
"Organic Gluten Free Pears, Kale, Peas and Quinoa Pur...",$2.49
"Organic Gluten Free Apples, Sweet Potatoes, Carrots,...",$2.49
Organic Cider Vinegar,$10.99
Organic Figs,$4.98
"Organic Lentil and Chick Pea Rusks with Blueberry, S...",$4.49
"1% Organic Partly Skimmed Milk, Fine-Filtered",$10.29
"Organic Wellness Shot, Ginger + Defence",$9.98
"Organic Wellness Shot, Smart + Energy",$9.98
"Organic Dried Cranberry Sweetened With Apple Juice, ...",$5.98
"Organic Dried Fruit Blend, Naturalia",$6.88
Organic Carrots,$3.88
"Organic Dried Fruit Blend, Naturalia",$6.88
"Whole Wheat Flour, Organic",$9.49
Organic Honey'd Corn Flakes Cereal,$5.99
Frozen Organic Skinless Chicken Breasts,$28.99
Organic Carrot Sticks with Lentils and Chick Pea Puf...,$4.49
Organic Rice and Quinoa Fusilli,$4.99
Organic Sprouted Multigrain Sliced Bread,$5.99
Organic Sprouted Whole Grain Sliced Bread with a lig...,$5.99
"Original Flavour Organic Almond Beverage, So Nice",$4.49
10% Organic Half And Half Cream,$4.59
35% Organic Whipping Cream,$6.49
"Organic Fruity Greens Snacks for Self-Feeders, Mushies",$4.49
Gluten Free Smoked Gouda Style Block Cheese,$5.98
Organic Chicken Drumsticks,$14.99
Frozen Organic Indian Mattar Paneer,$7.49
Organic Rice and Quinoa Spaghetti Pasta,$4.99
Organic Tomato Basil Pasta Sauce,$5.99
Banana Flavoured Organic Gluten Free Rice Rusks,$2.49
Apple Flavoured Organic Gluten Free Rice Rusks,$2.49
Organic Carrot & Apple Corn Snacks,$2.29
Organic Banana Berry with Greek Yogourt Snacks for S...,$4.49
Organic Chesse and Broccoli Quinoa Probiotics Puff S...,$4.49
"Salted Butter, Organic",$6.59
Organic Seedless Green Grape,$8.77
Gluten Free Medium Cheddar Block Cheese,$5.98
"Organic Extra Virgin Olive Oil, Rich Taste",$19.99
Chocolate Chips and Oatmeal Flavoured Organic and Gl...,$2.99
Organic Lentil and Chick Pea Rusks with Apple and Sw...,$4.49
Frozen Organic Cheddar Cheese Burrito,$5.49
"Organic Sweet Bell Peppers, Organics",$4.88
Organic Strawberry Beet Quinoa Probiotics Puff Snack...,$4.49
"Fortified Oat and Coconut Plant-Based Beverage, Next...",$4.79
Organic Seedless Red Grape,$8.77
Organic Original Soybean,$5.99
Banana Raisin Oatmeal Organic Wholegrain Cereal for ...,$5.99
Organic Chocolate and Peanut Butter Flavoured Energy...,$24.99
"Toasted Sesame Seed Oil, Organic",$6.99
"Frozen Pineapple Chunks, Organic",$4.44
Organic Lemonade,$3.29
Organic Chocolate Peanut Butter Flavoured Energy Bar...,$2.79
"Instant Oatmeal in Packets, Organic",$3.99
"Coconut Flour, Organic",$6.99
Organic Maple Nut Instant Oatmeal Packets,$5.49
Organic Cream Cheese Spread,$3.99
"Organic Peanut Butter Flavoured Energy Bar, Nut Butt...",$2.79
Frozen Organic Chicken Fillets,$14.99
Organic Gluten Free Dried Apricots,$4.98
"Organic Gluten Free Pears, Bananas, Blackberries, Ra...",$2.49
Unsweetened Vanilla Flavoured Organic Almond Beverag...,$4.49
Organic Herb Crackers,$7.49
"Whole Black Chia Seeds, Organic",$4.49
"Whole White Chia Seeds, Organic",$5.49
"Hulled Hemp Seeds, Organic",$7.49
"Flax, Chia and Hemp Seeds Blend, Organic",$5.49
Organic Gluten Free Everything Crackers,$7.49
"Organic Red Berry Flavoured Baby Yogurt Melts, 12+ M...",$4.99
"Organic Honey Flavoured Baby Biscuits, 12+ Months",$4.99
Bag of Organic Lemons,$3.98
Frozen Organic Chicken Wings,$17.99
Organic Dark Chocolate and Red Berries Granola Blend...,$5.99
"Unsalted Butter, Organic",$6.59
"Organic Banana, Apple and Plum Purée for Babies 6+ M...",$1.17
"Organic Banana and Apple Purée for Babies 6+ Months,...",$1.17
Macaroni & Cheddar Cheese,$6.99
Peanut Butter and Dark Chocolate Granola Bars,$1.99
"Organic Divine Grape™ Kombucha, Synergy",$4.29
"3.8% Organic Whole Milk, Fine filtered",$10.99
"Cane Sugar, Organic",$4.99
Organic Pear and Green Bean Purée for Babies 6+ Months,$1.17
Organic Apple and Carrot Purée for Babies 6+ Months,$1.17
"Organic Apple, Banana and Blueberry Purée for Babies...",$1.17
Organic Apple and Sweet Potato Purée for Babies 6+ M...,$1.17
"Organic Apple, Mango and Spinach Purée for Babies 6+...",$1.17
"Organic Apple, Carrot and Butternut Squash Purée for...",$1.17
"Virgin Coconut Oil, Organic",$6.49
"Organic Apple, Banana, Raspberry and Oatmeal Purée f...",$1.17
Organic Pear and Butternut Squash Purée for Babies 6...,$1.17
Organic Strawberry and Banana Flavoured Yogurt Baby ...,$4.99
Organic Strawberries,$5.98
"3.8% Organic Milk, Fine-Filtered",$7.39
"Butter Flavoured Popcorn, Organic",$2.99
"Original Flavour Popcorn, Organic",$2.99
Organic Gingerade™ Kombucha,$4.29
Organic Trilogy™ Kombucha,$4.29
Organic Celery,$3.98
Organic Carrots,$3.88
Organic Red Cluster Tomatoes,$6.80
Organic Extra Firm Tofu,$3.98
"Frozen Sliced Strawberries, Organic",$4.44
"Frozen Mixed Berries, Organic",$4.44
Unsweetened Original Flavour Organic Almond Beverage...,$4.49
"2% Organic Milk, Fine-Filtered",$7.19
"Frozen Chopped Kale, Organic",$3.99
"Belgian Chocolate Bar With Almonds, Organic",$3.49
"Frozen Pitted Dark Sweet Cherries, Organic",$4.44
"Creamy Peanut Butter, Organic",$4.44
Organic Multigrain Flakes Cereal,$9.99
"Organic Beef Broth, Naturalia",$2.99
Organic Arugula,$4.88
"2% Organic Milk, Fine-Filtered",$10.29
Organic Apple Juice,$3.29
Organic Crunchy Vanilla Cereal,$5.99
"Chicken Broth, Organic",$2.99
Organic Banana,$0.48
Organic Spring Mix,$4.88
Organic Original Crackers,$7.49
Frozen Organic Pad Thai,$7.49
"Frozen Organic Waffles, Homestyle",$5.49
Organic Baby Spinach,$4.88
Mixed Berry Granola Bars,$4.99
"Barista Soy Beverage, Barista Edition",$3.49
"Amber Pure Honey, Organics",$6.99
Chocolate-Banana Granola Bars,$4.99
Organic Hibiscus and Rose Hips Flavoured Kombucha,$3.99
"Organic Ancient Grains Cereal, Heritage Flakes",$9.99
Chocolate Chip Granola Bars,$4.99
Organic Ginger Flavoured Kombucha,$3.99
Organic Mango & Orange Juice,$3.29
